{
  "timestamp": "2026-07-06T21:25:17.462Z",
  "designer": "demo-designer",
  "tool": "cursor",
  "compassVersion": "0.1.0",
  "source": "S4 pipeline demo build B (synthetic)",
  "targetFiles": [
    "lib/s4-selftest/build-b.tsx"
  ],
  "componentsUsed": [
    "card"
  ],
  "assumptions": [
    {
      "text": "assumed the Card border should be default",
      "category": "styling"
    }
  ],
  "gitHead": "a3b9dba31702df7fbeb15508049d54b9265bee1b",
  "notes": "synthetic fixture for S4 pipeline verification",
  "demo": true
}
